{
  "$schema": "https://json-schema.org/draft/2020-12/schema",
  "$id": "map-event.schema.json",
  "title": "Map operation event request",
  "description": "POST /map-events body only. Existing allowlist; UUID normalization, timezone parsing and raw byte limits remain server checks. Custom IMG operations are excluded.",
  "type": "object",
  "properties": {
    "schemaVersion": {
      "const": 1,
      "description": "Integer 1 only; a boolean true is rejected with 400 (it is not a schema version)."
    },
    "id": {
      "type": "string",
      "description": "Random UUID accepted and normalized by Python UUID; no physical device identifier."
    },
    "operationId": {
      "type": "string",
      "description": "Random UUID linking map events within an operation; no persistent device identity."
    },
    "mapResultIndex": {
      "type": [
        "integer",
        "null"
      ],
      "minimum": 0,
      "description": "Optional zero-based index of the independent map result within the operation.",
      "maximum": 2147483647
    },
    "timestamp": {
      "type": "string",
      "description": "ISO timestamp parsed by datetime.fromisoformat; timezone required and not before 2026-08-01T00:00:00Z."
    },
    "providerId": {
      "$ref": "#/$defs/safeId",
      "not": {
        "pattern": "^[cC][uU][sS][tT][oO][mM]$"
      }
    },
    "mapId": {
      "anyOf": [
        {
          "$ref": "#/$defs/safeId"
        },
        {
          "type": "null"
        }
      ]
    },
    "region": {
      "anyOf": [
        {
          "$ref": "#/$defs/safeId"
        },
        {
          "type": "null"
        }
      ]
    },
    "eventType": {
      "enum": [
        "DOWNLOAD_STARTED",
        "DOWNLOAD_SUCCEEDED",
        "DOWNLOAD_FAILED",
        "INSTALL_SUCCEEDED",
        "INSTALL_FAILED",
        "MAP_UPDATE_SUCCEEDED",
        "MAP_UPDATE_FAILED",
        "DOWNLOAD_PROCESSING",
        "DOWNLOAD_CANCELLED",
        "DOWNLOAD_INTERRUPTED"
      ]
    },
    "outcome": {
      "enum": [
        "SUCCEEDED",
        "FAILED",
        "UNKNOWN"
      ]
    },
    "appBuild": {
      "type": [
        "string",
        "null"
      ],
      "maxLength": 80,
      "pattern": "\\S"
    },
    "releaseLabel": {
      "$ref": "#/$defs/releaseLabel",
      "description": "SemVer app release identity. Local debug builds end in -local and are purgeable only in the authenticated admin test-data flow. Required for every client except the exact released beta.9 shape (builds 10/11), which predates this field and is stored with an unknown release."
    },
    "acquisitionId": {
      "type": [
        "string",
        "null"
      ],
      "description": "Random UUID for one component acquisition attempt."
    },
    "componentKind": {
      "enum": [
        "main",
        "contours",
        null
      ]
    },
    "acquisitionPurpose": {
      "enum": [
        "install",
        "update",
        null
      ],
      "description": "Optional explicit reason for a component download. Absent/null historical values remain unknown; never infer from a missing install/update result."
    }
  },
  "required": [
    "schemaVersion",
    "id",
    "operationId",
    "timestamp",
    "providerId",
    "eventType",
    "outcome"
  ],
  "additionalProperties": false,
  "$defs": {
    "safeId": {
      "type": "string",
      "pattern": "^[a-zA-Z0-9][a-zA-Z0-9._-]{0,159}$"
    },
    "releaseLabel": {
      "type": "string",
      "maxLength": 80,
      "pattern": "^(0|[1-9][0-9]*)\\.(0|[1-9][0-9]*)\\.(0|[1-9][0-9]*)(-[0-9A-Za-z-]+(\\.[0-9A-Za-z-]+)*)?(\\+[0-9A-Za-z-]+(\\.[0-9A-Za-z-]+)*)?$"
    }
  },
  "allOf": [
    {
      "description": "releaseLabel is required unless the body is the exact released beta.9 (builds 10/11) shape, which predates it.",
      "anyOf": [
        {
          "required": [
            "releaseLabel"
          ]
        },
        {
          "required": [
            "appBuild",
            "mapId"
          ],
          "properties": {
            "eventType": {
              "enum": [
                "DOWNLOAD_STARTED",
                "DOWNLOAD_SUCCEEDED",
                "DOWNLOAD_FAILED",
                "INSTALL_SUCCEEDED",
                "INSTALL_FAILED"
              ]
            },
            "appBuild": {
              "type": "string"
            },
            "mapId": {
              "type": "string"
            }
          },
          "not": {
            "anyOf": [
              {
                "required": [
                  "acquisitionId"
                ]
              },
              {
                "required": [
                  "componentKind"
                ]
              },
              {
                "required": [
                  "acquisitionPurpose"
                ]
              },
              {
                "required": [
                  "mapResultIndex"
                ]
              }
            ]
          }
        }
      ]
    },
    {
      "if": {
        "properties": {
          "eventType": {
            "enum": [
              "DOWNLOAD_PROCESSING",
              "DOWNLOAD_CANCELLED",
              "DOWNLOAD_INTERRUPTED"
            ]
          }
        },
        "required": [
          "eventType"
        ]
      },
      "then": {
        "required": [
          "acquisitionId",
          "componentKind"
        ],
        "properties": {
          "acquisitionId": {
            "type": "string"
          },
          "componentKind": {
            "enum": [
              "main",
              "contours"
            ]
          },
          "outcome": {
            "const": "UNKNOWN"
          }
        }
      }
    },
    {
      "if": {
        "properties": {
          "acquisitionId": {
            "type": "string"
          }
        },
        "required": [
          "acquisitionId"
        ]
      },
      "then": {
        "required": [
          "componentKind"
        ],
        "properties": {
          "componentKind": {
            "enum": [
              "main",
              "contours"
            ]
          },
          "eventType": {
            "pattern": "^DOWNLOAD_"
          }
        }
      }
    },
    {
      "if": {
        "properties": {
          "componentKind": {
            "type": "string"
          }
        },
        "required": [
          "componentKind"
        ]
      },
      "then": {
        "required": [
          "acquisitionId"
        ],
        "properties": {
          "acquisitionId": {
            "type": "string"
          }
        }
      }
    },
    {
      "if": {
        "properties": {
          "eventType": {
            "const": "DOWNLOAD_STARTED"
          }
        },
        "required": [
          "eventType"
        ]
      },
      "then": {
        "properties": {
          "outcome": {
            "const": "UNKNOWN"
          }
        }
      }
    },
    {
      "if": {
        "properties": {
          "eventType": {
            "const": "DOWNLOAD_SUCCEEDED"
          }
        },
        "required": [
          "eventType"
        ]
      },
      "then": {
        "properties": {
          "outcome": {
            "const": "SUCCEEDED"
          }
        }
      }
    },
    {
      "if": {
        "properties": {
          "eventType": {
            "const": "DOWNLOAD_FAILED"
          }
        },
        "required": [
          "eventType"
        ]
      },
      "then": {
        "properties": {
          "outcome": {
            "const": "FAILED"
          }
        }
      }
    },
    {
      "if": {
        "properties": {
          "eventType": {
            "enum": [
              "INSTALL_SUCCEEDED",
              "MAP_UPDATE_SUCCEEDED"
            ]
          }
        },
        "required": [
          "eventType"
        ]
      },
      "then": {
        "properties": {
          "outcome": {
            "const": "SUCCEEDED"
          }
        }
      }
    },
    {
      "if": {
        "properties": {
          "eventType": {
            "enum": [
              "INSTALL_FAILED",
              "MAP_UPDATE_FAILED"
            ]
          }
        },
        "required": [
          "eventType"
        ]
      },
      "then": {
        "properties": {
          "outcome": {
            "const": "FAILED"
          }
        }
      }
    },
    {
      "if": {
        "properties": {
          "acquisitionPurpose": {
            "type": "string"
          }
        },
        "required": [
          "acquisitionPurpose"
        ]
      },
      "then": {
        "required": [
          "acquisitionId",
          "componentKind"
        ],
        "properties": {
          "acquisitionId": {
            "type": "string"
          },
          "componentKind": {
            "enum": [
              "main",
              "contours"
            ]
          },
          "eventType": {
            "pattern": "^DOWNLOAD_"
          }
        }
      }
    }
  ]
}
